Descartes	<i>Lettre à Morus</i>, 5 février 1649	Je regarde comme une chose démontrée qu’on ne saurait prouver qu’il y ait des pensées dans les bêtes […]. Il est plus probable de faire mouvoir comme des machines les vers de terre, les moucherons, les chenilles et le reste des animaux, que de leur donner une âme immortelle.<br/>Premièrement parce qu’il est certain que, dans les corps des animaux, ainsi que dans les nôtres, il y a des os, des nerfs, des muscles, du sang, des esprits animaux, et autres organes disposés de telle sorte qu’ils peuvent produire par eux-mêmes, sans le secours d’aucune pensée, tous les mouvements que nous observons dans les animaux, ce qui paraît dans les mouvements convulsifs, lorsque, malgré l’âme même, la machine du corps se meut souvent avec plus de violence et en plus de différentes manières qu’il n’a coutume de le faire avec les secours de la volonté; d’ailleurs parce qu’il est conforme à la raison que l’art imitant la nature, et les hommes pouvant construire divers automates où il se trouve du mouvement sans aucune pensée, la nature puisse de son côté produire ses automates, et bien plus excellents, comme les brutes, que ceux qui viennent de main d’homme, surtout ne voyant aucune raison pour laquelle la pensée doive se trouver partout où nous voyons une conformation de membres telle que celle des animaux et qu’il est plus surprenant qu’il y ait une âme dans chaque corps humain que de n’en point trouver dans les bêtes.<br/>La principale raison, selon moi, qui peut nous persuader que les bêtes sont privées de raison, est que, bien que parmi celles d’une même espèce les unes soient plus parfaites que les autres, comme dans les hommes, ce qui se remarque particulièrement dans les chevaux et dans les chiens, dont les uns ont plus de dispositions que les autres à retenir ce qu’on leur apprend, et bien qu’elles nous fassent toutes connaître clairement leurs mouvements naturels de colère, de crainte, de faim, et d’autres semblables, ou par la voix, ou par d’autres mouvements du corps, on n’a point cependant encore observé qu’aucun animal fût parvenu à ce degré de perfection d’user d’un véritable langage, c’est-à-dire qui nous marquât par la voix, ou par d’autres signes, quelque chose qui pût se rapporter plutôt à la seule pensée qu’à un mouvement naturel. Car la parole est l’unique signe et la seule marque assurée de la pensée cachée et renfermée dans les corps; or tous les hommes les plus stupides et les plus insensés, ceux mêmes qui sont privés des organes de la langue et de la parole, se servent de signes, au lieu que les bêtes ne font rien de semblable, ce que l’on peut prendre pour la véritable différence entre l’homme et la bête.<br/>Je passe, pour abréger, les autres raisons qui ôtent la pensée aux bêtes. Il faut pourtant remarquer que je parle de la pensée, non de la vie, ou du sentiment; car je n’ôte la vie à aucun animal, ne la faisant consister que dans la seule chaleur de coeur. Je ne leur refuse pas même le sentiment autant qu’il dépend des organes du corps. Ainsi, mon opinion n’est pas si cruelle aux animaux qu’elle est favorable aux hommes, je dis à ceux qui ne sont point attachés aux rêveries de Pythagore, puisqu’elle les garantit du soupçon même de crime quand ils mangent ou tuent des animaux.
Descola (Philippe)	<i>Par-delà nature et culture</i> (2005)	Les formules autorisées par la combinaison de l'intériorité et de la physicalité sont très réduites : face à un autrui quelconque, humain ou non humain, je peux supposer soit qu'il possède des éléments de physicalité et d'intériorité identiques aux miens, soit que son intériorité et sa physicalité sont distinctes des miennes, soit encore que nous avons des intériorités similaires et des physicalités hétérogènes, soit enfin que nos intériorités sont différentes et nos physicalités analogues. J'appelai “totémisme” la première combinaison, “analogisme” la deuxième, “animisme” la troisième et “naturalisme” la dernière. Ces principes d'identification définissent quatres grands types d'ontologie, c'est-à-dire de systèmes de propriétés des existants, lesquels servent de point d'ancrage à des formes contrastées de cosmologies, de modèles du lien social et de théories de l'identité et de l'altérité.
Dewey (John)	<i>Reconstruction en philosophie</i> (1920)	L'homme préserve ses expériences passées : c'est en cela qu'il diffère des animaux inférieurs. Ce qui a eu lieu dans le passé est vécu à nouveau dans le souvenir. Ce qui se passe aujourd'hui évoque un flot de pensées concernant des choses similaires vécues jadis. Chez les animaux, l'expérience prend fin au moment même où elle survient et chaque nouvel act, chaque nouvelle souffrance sont isolés. Par contre, l'homme est dans un monde où chaque expérience est chargée des réminiscences de ce qui a précédé, et où chaque événement rappelle d'autres choses. Contrairement aux bêtes à l'état naturel, il ne vit donc pas dans un monde chosifié, mais dans un univers de signes et de symboles. Une pierre n'est pas simplement cette chose dure, sur laquelle on trébuche : c'est aussi un monument à un ancêtre défunt. Une flamme ne se réduit pas à cette chose qui réchauffe et qui brille : c'est aussi un symbole de la permanence de la vie du foyer, d'une source durable de réconfort, de nourriture et d'abri à laquelle on retourne après ses errances. Ce n'est pas seulement cette source de chaleur vive à laquelle on se brûle, c'est aussi le foyer que l'on défend et qui abrite nos prières. C'est cela qui fait la différence entre bestialité et humanité, entre nature purement physique et culture : l'homme est un être de mémoire. Il conserve et préserve ses expériences.
Diogene	<i>Vie, doctrines et sentences des philosophes illustres</i>	Ayant vu un jour une souris qui courait sans se soucier de trouver un gîte, sans crainte de l'obscurité, et sans aucun désir de tout ce qui rend la vie agréable, il la prit pour modèle et trouva le remède à son dénuement. Il fit d'abord doubler son manteau, pour sa commodité, et pour y dormir la nuit enveloppé, puis il prit une besace, pour y mettre ses vivres, et résolut de manger, dormir et parler en n'importe quel lieu.<br/>Il s'étonnait de voir les grammairiens tant étudier les mœurs d'Ulysse, et négliger les leurs, de voir les musiciens si bien accorder leur lyre, et oublier d'accorder leur âme, de voir les mathématiciens étudier le soleil et la lune, et oublier ce qu'ils ont sous les pieds, de voir les orateurs pleins de zèle pour bien dire, mais jamais pressés de bien faire, de voir les avares blâmer l'argent, et pourtant l'aimer comme des fous. Il reprenait ceux qui louent les gens vertueux parce qu'ils méprisent les richesses, et qui dans le même temps envient les riches. Il était indigné de voir des hommes faire des sacrifices pour conserver la santé, et en même temps se gaver de nourriture pendant ces sacrifices, sans aucun souci de leur santé.<br/>Il affirmait opposer à la fortune son assurance, à la loi sa nature, à la douleur sa raison. Dans le Cranéion, à une heure où il faisait soleil, Alexandre le rencontrant lui dit : “Demande-moi ce que tu veux, tu l'auras.” Il lui répondit : “Ôte-toi de mon soleil !”<br/>Il se promenait en plein jour avec une lanterne et répétait : “Je cherche un homme.”<br/>Pendant un repas, on lui jeta des os comme à un chien; alors, s'approchant des convives, il leur pissa dessus comme un chien.<br/>On lui demanda pourquoi il était appelé chien : “Parce que je caresse ceux qui me donnent, j'aboie contre ceux qui ne me donnent pas, et je mors ceux qui sont méchants.” Quelqu'un lui dit : “Tu ne sais rien, et tu fais le philosophe.” “Mais, dit-il, simuler la sagesse, c'est encore être philosophe.”<br/>On lui demandait ce qu'il y avait de plus beau au monde : “La franchise”, dit-il.<br/>Il avait coutume de tout faire en public, les repas et l'amour, et il raisonnait ainsi : “S'il n'y a pas de mal à manger, il n'y en a pas non plus à manger en public; or il n'y a pas de mal à manger, donc il n'y a pas de mal à manger en public.” De même il se masturbait toujours en public, en disant : “Plût au ciel qu'il suffît également de se frotter le ventre pour apaiser sa faim.”<br/>Il ne voyait pas qu'il fût mal d'emporter les objets d'un temple, ou de manger la chair de n'importe quel animal, et ne trouva pas si odieux le fait de manger de la chair humaine, comme le font des peuples étrangers, disant qu'en saine raison, tout est dans tout et partout.<br/>Quelques auteurs veulent qu'il ait demandé qu'on laissât son corps sans sépulture, pour que les chiens pussent y prendre leur morceau, et qu'au moins, si on tenait à le mettre en fosse, on le recouvrît seulement d'un peu de poussière.
Durkheim	“L'éducation, sa nature et son rôle”, dans <i>Education et sociologie</i> (1922)	En chacun de nous, peut-on dire, il existe deux êtres qui, pour être inséparables autrement que par abstraction, ne laissent pas d'être distincts. L'un est fait de tous les états mentaux qui ne se rapportent qu'à nous-mêmes et aux événements de notre vie personnelle : c'est ce qu'on pourrait appeler l'être individuel. L'autre est un système d'idées, de sentiments et d'habitudes qui expriment en nous, non pas notre personnalité, mais le groupe ou les différents groupes dont nous faisons partie ; telles sont les croyances religieuses, les croyances et les pratiques morales, les traditions nationales ou professionnelles, les opinions collectives de toute sorte. Leur ensemble forme l'être social. Constituer cet être en chacun de nous, telle est la fin de l'éducation.<br/>C'est par là, d'ailleurs, que se montre le mieux l'importance de son rôle et la fécondité de son action. En effet, non seulement cet être social n'est pas donné tout à fait dans la constitution primitive de l'homme ; mais il n'en est pas résulté par un développement spontané. Spontanément, l'homme n'était pas enclin à se soumettre à une autorité politique, à respecter une discipline morale, à se dévouer, à se sacrifier. Il n'y avait rien dans notre nature congénitale qui nous prédisposât à devenir les serviteurs de divinités, emblèmes symboliques de la société, à leur rendre un culte, à nous priver pour leur faire honneur. C'est la société elle-même qui, à mesure qu'elle s'est formée et consolidée, a tiré de son propre sein ces grandes forces morales devant lesquelles l'homme a senti son infériorité. Or, si l'on fait abstraction des vagues et incertaines tendances qui peuvent être dues à l'hérédité, l'enfant, en entrant dans la vie, n'y apporte que sa nature d'individu. La société se trouve donc, pour ainsi dire, à chaque génération nouvelle, en présence d'une table presque rase sur laquelle il lui faut construire à nouveaux frais. Il faut que, par les voies les plus rapides, à l'être égoïste et asocial qui vient de naître, elle en surajoute un autre, capable de mener une vie morale et sociale. Voilà quelle est l'oeuvre de l'éducation, et l'on en aperçoit toute la grandeur. Elle ne se borne pas à développer l'organisme individuel dans le sens marqué par sa nature, à rendre apparentes des puissances cachées qui ne demandaient qu'à se révéler. Elle crée dans l'homme un être nouveau.
Durkheim	“L'éducation, sa nature et son rôle”, dans <i>Éducation et sociologie</i> (1922)	On voit à quoi se réduirait l'homme, si l'on en retirait tout ce qu'il tient de la société : il tomberait au rang de l'animal. S'il a pu dépasser le stade auquel les animaux se sont arrêtés, c'est d'abord qu'il n'est pas réduit au seul fruit de ses efforts personnels, mais coopère régulièrement avec ses semblables ; ce qui renforce le rendement de l'activité de chacun. C'est ensuite et surtout que les produits du travail d'une génération ne sont pas perdus pour celle qui suit. De ce qu'un animal a pu apprendre au cours de son existence individuelle, presque rien ne peut lui survivre. Au contraire, les résultats de l'expérience humaine se conservent presque intégralement et jusque dans le détail, grâce aux livres, aux monuments figurés, aux outils, aux instruments de toute sorte qui se transmettent de génération en génération, à la tradition orale, etc. Le sol de la nature se recouvre ainsi d'une riche alluvion qui va sans cesse en croissant. Au lieu de se dissiper toutes les fois qu'une génération s'éteint et est remplacée par une autre, la sagesse humaine s'accumule sans terme, et c'est cette accumulation indéfinie qui élève l'homme au-dessus de la bête et au-dessus de lui-même. Mais, tout comme la coopération dont il était d'abord question, cette accumulation n'est possible que dans et par la société. Car, pour que le legs de chaque génération puisse être conservé et ajouté aux autres, il faut qu'il y ait une personnalité morale qui dure par-dessus les générations qui passent, qui les relie les unes aux autres : c'est la société.
Epictete	<i>Entretiens</i>	Voici le point de départ de la philosophie : la conscience du conflit qui met aux prises les hommes entre eux, la recherche de l'origine de ce conflit, la condamnation de la simple opinion et la défiance à son égard, une sorte de critique de l'opinion pour déterminer si on a raison de la tenir, l'invention d'une norme, de même que nous avons inventé la balance pour la détermination du poids, ou le cordeau pour distinguer ce qui est droit et ce qui est tordu. Est-ce là le point de départ de la philosophie ? Est juste tout ce qui paraît tel à chacun. Et comment est-il possible que les opinions qui se contredisent soient justes ? Par conséquent, non pas toutes. Mais celles qui nous paraissent à nous justes ? Pourquoi à nous plutôt qu'aux Syriens, plutôt qu'aux Égyptiens ? Plutôt que celles qui paraissent telles à moi ou à un tel ? Pas plus les unes que les autres. Donc l'opinion de chacun n'est pas suffisante pour déterminer la vérité. Nous ne nous contentons pas non plus quand il s'agit de poids ou de mesures de la simple apparence, mais nous avons inventé une norme pour ces différents cas. Et dans le cas présent, n'y a-t-il donc aucune norme supérieure à l'opinion ? Et comment est-il possible qu'il n'y ait aucun moyen de déterminer et de découvrir ce qu'il y a pour les hommes de plus nécessaire ? Il y a donc une norme. Alors, pourquoi ne pas la chercher et ne pas la trouver, et après l'avoir trouvée, pourquoi ne pas nous en servir par la suite rigoureusement, sans nous en écarter d'un pouce ?
Épicure		La foule tantôt fuit la mort comme le plus grand des maux, tantôt la désire comme le terme des misères de la vie. Le sage, par contre, ne fait pas fi de la vie et ne craint pas la mort, car la vie ne lui est pas à charge et il ne considère pas la non-existence comme un mal. En effet, de même qu'il ne choisit certainement pas la nourriture la plus abondante, mais celle qui est la plus agréable, pareillement il ne tient pas à jouir de la durée la plus longue, mais de la durée la plus agréable. Celui qui proclame qu'il appartient au jeune homme de bien vivre et au vieillard de bien mourir, est passablement sot, non seulement parce que la vie est aimée de l'un aussi bien que de l'autre, mais surtout parce que l'application à bien vivre ne se distingue pas de celle à bien mourir. Plus sot est encore celui qui dit que le mieux c'est de ne pas naître.
Eric Weil	<i>Philosophie politique</i> (1956)	C'est le gouvernement qui, dans l'État moderne, forme le seul ressort de l'action. Même là où d'autres pouvoirs (légaux) exercent une action politique, celle-ci ne s'effectue que par l'entremise du gouvernement, que les autres pouvoirs peuvent inciter à agir, mais ne peuvent pas remplacer. Le gouvernement seul parle au nom de l'État, aussi bien à l'intérieur qu'à l'extérieur. […]<br/>La difficulté est partout la même : dans n'importe quelle forme d'État, les opinions personnelles des gouvernants, leurs intérêts particuliers, leurs passions peuvent l'emporter sur le principe de la rationalité. Partout, les réactions du peuple peuvent empêcher la réalisation des buts les plus rationnellement choisis par un gouvernement purement calculateur de l'intérêt de l'État. Nulle part, enfin, le gouvernement ne peut être sûr de posséder par lui-même tous les renseignements requis pour l'analyse d'abord, pour la décision efficace ensuite, ni de connaître toutes les méthodes disponibles. Dans tous les cas, le gouvernement (au sens précis du terme : le groupe de ceux qui prennent les décisions) ne peut à lui seul rassembler les données, analyser les tendances, discerner toutes les actions et toutes les procédures possibles, et jamais l'opinion publique ne sera suffisamment instruite des questions techniques pour pouvoir suppléer aux défaillances du gouvernement.<br/>Aussi, dans les États modernes, une même solution a été donnée à une difficulté identique. L'État moderne est organisation consciente d'une communauté qui travaille rationnellement ; le gouvernement qui dirige les affaires de cette communauté-société doit être renseigné pour pouvoir délibérer et décider : l'appareil destiné à remplir cette fonction est l'administration.
Forer (Bertram)	“The Fallacy of Personal Validation” (1949)	Vous avez besoin d'être aimé et admiré, et pourtant vous êtes critique avec vous-même. Vous avez certes des points faibles dans votre personnalité, mais vous savez généralement les compenser. Vous avez un potentiel considérable que vous n'avez pas encore utilisé à votre avantage. À l'extérieur vous êtes discipliné et vous savez vous contrôler, mais à l'intérieur vous tendez à être préoccupé et pas très sûr de vous-même. Parfois vous vous demandez sérieusement si vous avez pris la bonne décision ou accompli ce qu'il fallait. Vous préférez une certaine dose de changement et de variété, et devenez insatisfait si l'on vous entoure de restrictions et de limitations. Vous vous flattez d'être un esprit indépendant ; et vous n'acceptez l'opinion d'autrui que dûment démontrée. Vous avez trouvé qu'il était maladroit de se révéler trop facilement aux autres. Par moment vous êtes très extraverti, bavard et sociable, tandis qu'à d'autres moments vous êtes introverti, circonspect, et réservé. Certaines de vos aspirations tendent à être assez irréalistes.
Fourastié (Jean)	<i>La grande métamorphose du XXe siècle</i> (1961)	On doit penser aujourd'hui, sans parler des races éteintes, que l'homo sapiens existe sur la terre depuis soixante à cent mille ans ; que l'état actuel du cosmos lui promet une postérité de plusieurs millions d'années.<br/>En limitant à un million d'années l'ordre de grandeur de la durée du phénomène humain, on peut apprécier que nous en avons vécu le dixième, et qu'il nous en reste à vivre les neuf dixièmes.<br/>Ainsi la durée de l'humanité serait à celle de l'individu dans le rapport à 10000 à 1. L'humanité d'aujourd'hui serait l'humanité accomplie comme l'enfant de 10 ans devant le vieillard. Mille ans d'humanité correspondent à un mois de vie individuelle.<br/>Nous, humanité, nous avons dix ans. Pendant nos 5 ou 6 premières années, sans parent et sans maître, nous avons à peine pu nous distinguer d'autres mammifères ; puis nous avons trouvé l'art, la morale, le droit, la religion.<br/>Nous savons lire et écrire depuis moins d'un an. Nous avons construit le Parthénon voici moins de trois mois ; il y a deux mois, le Christ est né. Il y a moins de 15 jours, nous avons commencé d'identifier clairement la méthode scientifique expérimentale, qui nous permet de connaître quelques réalités de l'univers ; il y a deux jours que nous savons utiliser l'électricité et construire des avions. […]<br/>Nous sommes un petit garçon de dix ans, courageux, fort et plein de promesses ; nous saurons dès l'an prochain faire beaucoup de dictées sans fautes et calculer correctement les règles de trois. Dans deux ans, nous entrerons en classe de sixième et nous ferons notre première communion solennelle.<br/>Dans 100 000 ans nous atteindrons notre majorité.
Freud		Nous voyons combien la réalité nous satisfait peu malgré nos prétentions ; aussi, sous la pression de nos refoulements intérieurs, entretenons-nous au-dedans de nous toute une vie de fantaisie qui, en réalisant nos désirs, compense les insuffisances de l'existence véritable. L'homme énergique et qui réussit, c'est celui qui parvient à transmuer en réalités les fantaisies du désir. Quand cette transmutation échoue par la faute des circonstances extérieures et de la faiblesse de l'individu, celui-ci se détourne du réel ; il se retire dans l'univers plus heureux de son rêve ; en cas de maladie il en transforme le contenu en symptômes. Dans certaines conditions favorables il peut encore trouver un autre moyen de passer de ses fantaisies à la réalité, au lieu de s'écarter définitivement d'elle par régression dans le domaine infantile ; j'entends que, s'il possède le “don artistique”, psychologiquement si mystérieux, il peut, au lieu de symptômes, transformer ses rêves en créations esthétiques. Ainsi échappe-t-il au destin de la névrose et trouve-t-il par ce détour un rapport avec la réalité. Quand cette précieuse faculté manque ou se montre insuffisante, il devient inévitable que la libido parvienne, par régression, à la réapparition des désirs infantiles, et donc à la névrose. La névrose remplace, à notre époque, le cloître où avaient coutume de se retirer toutes les personnes déçues par la vie ou trop faibles pour la supporter.
Freud		Une violente répression d'instincts puissants exercée de l'extérieur n'apporte jamais pour résultat l'extinction ou la domination de ceux-ci, mais occasionne un refoulement qui installe la propension à entrer ultérieurement dans la névrose. La psychanalyse a souvent eu l'occasion d'apprendre à quel point la sévérité indubitablement sans discernement de l'éducation participe à la production de la maladie nerveuse, ou au prix de quel préjudice de la capacité d'agir et de la capacité de jouir la normalité exigée est acquise. Elle peut aussi enseigner quelle précieuse contribution à la formation du caractère fournissent ces instincts asociaux et pervers de l'enfant, s'ils ne sont pas soumis au refoulement, mais sont écartés par le processus dénommé “sublimation” de leurs buts primitifs vers des buts plus précieux. Nos meilleures vertus sont nées comme formations réactionnelles et sublimations sur l'humus de nos plus mauvaises dispositions. L'éducation devrait se garder soigneusement de combler ces sources de forces fécondes et se borner à favoriser les processus par lesquels ces énergies sont conduites vers le bon chemin.
