Sevrin (Geneviève)	Préface à l’ouvrage de Colombe Camus, <i>La guerre contre le terrorisme, dérives sécuritaires et dilemme démocratique</i> (2007)	Sécurité et droits humains ne sont pas incompatibles. Au contraire, ils sont indissociables. Dans une société où les gens sont à l’abri des agressions et des attentats, d’où qu’ils viennent, les droits à la vie et à l’intégrité physique et mentale sont respectés. Le droit de ne pas être soumis à la torture ou à d’autres traitements cruels, inhumains ou dégradants est au cœur d’une société sûre et démocratique. […] Les gouvernements ont le devoir de prendre toutes les mesures acceptables pour empêcher que des attentats terroristes ne soient commis sur leur territoire, et pour traduire en justice les personnes soupçonnées d’avoir perpétré ou planifié de tels actes. Ils ne doivent toutefois pas répondre à la terreur par la terreur, c'est-à-dire utiliser les mêmes armes que les terroristes, se rabaisser à leur niveau et instiller encore plus de peur dans les esprits des citoyens. Cette peur ne participe qu’à alimenter les clivages, les antagonismes, les discriminations. Elle contribue à justifier et à légitimer une répression massive et transnationale, au nom de la sécurité et d’une « guerre globale contre la terreur. » <br/>Les droits humains et les libertés fondamentales ne sont pas un luxe réservé aux périodes fastes. Ils doivent être respectés en permanence, y compris en période de danger et d’insécurité. Les règles claires et consensuelles, définies par la communauté internationale dans le cadre de traités relatifs aux droits humains, doivent être respectées plus que jamais lors des conflits, lors des situations d’urgence ou des crises, car c’est justement dans ces moments-là que l’on cherche à justifier, au nom de la « nécessité », les violations les plus atroces. Le respect des droits humains ne compromet pas la sécurité, il y conduit.<br/>Face à la menace terroriste, notre meilleure défense est le respect de nos droits. 
Hadot (Pierre)	<i>La philosophie comme éducation des adultes. Textes, perspectives, entretiens</i> (2019)	Dans l'Antiquité, l'éducation, et même l'éducation de soi par soi, est conçue comme l'action d'un supérieur sur un inférieur, d'un adulte sur un enfant. Simplicius <sup>1</sup>, par exemple, définit l'éducation en ces termes : « L'éducation, c'est proprement le redressement de l'enfant qui est en nous par le pédagogue qui est en nous », et il explique ensuite qu'il veut désigner par là l'éducation de notre sensibilité par notre <em>logos</em> <sup>2</sup>. Cette représentation de « l'enfant qui est en nous » est inspirée par le fameux passage du Phédon [77e]3, où un personnage du dialogue répond à Socrate : « Il y a peut-être au-dedans de nous un enfant qui craint ces sortes de choses : c'est lui que tu dois essayer de convaincre pour l'empêcher d'avoir peur de la mort comme d'un épouvantail. » (…) Pour Hilary Putnam <sup>4</sup> et Stanley Cavell, qu'il cite, la notion « d'enfant en nous » ne représente pas du tout la partie irrationnelle de notre être, mais, au contraire, ce qui en nous pose des questions et remet en question ce qui semble acquis, de même qu'un enfant peut remettre en question ce sur quoi l'adulte ne se pose plus de questions : « Pourquoi mangeons-nous des animaux ? », « Pourquoi y a-t-il des gens qui sont riches et d'autres qui sont pauvres ? », « Qu'est-ce que Dieu ? », etc. C'est finalement cette remise en question qui est le point de départ de la philosophie, et essayer de répondre à l'enfant qui est en nous, c'est commencer à nous éduquer nous-mêmes et à penser par nous-mêmes.	1: philosophe grec, 5e siècle (après JC) ; 2: raison, discours rationnel ; 3: célèbre dialogue de Platon relatant la mort de Socrate ; les chiffres entre crochets indique le passage du texte ; 4: philosophe américain du 20e siècle.
Alain	<i>Propos sur le bonheur</i> (1924)	Faire et non pas subir, tel est le fond de l'agréable. Mais parce que lessucreries donnent un petit plaisir sans qu'on ait autre chose à faire qu'à leslaisser fondre, beaucoup de gens voudraient goûter le bonheur de la mêmemanière, et sont bien trompés. On reçoit peu de plaisir de la musique si l'onse borne à l'entendre et si on ne la chante point du tout, ce qui faisait dire àun homme ingénieux qu'il goûtait la musique par la gorge, et non point parl'oreille. Même le plaisir qui vient des beaux dessins est un plaisir de repos,et qui n'occuperait pas assez, si l'on ne barbouillait soi-même, ou si l'on nese faisait une collection; ce n'est plus seulement juger, c'est rechercher etconquérir. [...] Ceux qui jouent aux cartes inventent continuellement etmodifient le cours mécanique des événements. Ne demandez pas à celui quine sait point jouer s'il aime le jeu. La politique n'ennuie point dès que l'onsait le jeu; mais il faut l'apprendre. Ainsi en toutes choses; il fautapprendre à être heureux.On dit que le bonheur nous fuit toujours. Cela est vrai du bonheur reçu,parce qu'il n'y a point de bonheur reçu. Mais le bonheur que l'on se construitne trompe point. C'est apprendre, et l'on apprend toujours. Plus on sait, etplus on est capable d'apprendre. D'où le plaisir d'être musicien, qui n'a pointde fin, mais qui plutôt s'augmente par le progrès. [...] Le signe du progrèsvéritable en toute action est le plaisir qu'on y sait prendre. D'où l'on voit quele travail est la seule chose délicieuse, et qui suffit. J'entends par là untravail libre, qui nous permet d’exercer nos facultés, de les aiguiser et d’enacquérir de nouvelles. Encore une fois, non point subir, mais agir.
Freud	<i>Introduction à la psychanalyse</i>, éd. Payot, p. 266-267	C'est en attribuant une importance pareille à l'inconscient dans la vie psychique que nous avons dressé contre la psychanalyse les plus méchants esprits de la critique. Ne vous en étonnez pas et ne croyez pas que la résistance qu'on nous oppose tienne à la difficulté de concevoir l'inconscient ou à l'inaccessibilité des expériences qui s'y rapportent. Dans le cours des siècles, la science à infligé à l'égoïsme naïf de l'humanité deux graves démentis. La première fois, ce fut lorsqu'elle a montré que la terre, loin d'être le centre de l'univers, ne forme qu'une parcelle insignifiante du système cosmique dont nous pouvons à peine nous représenter la grandeur. Cette première démonstration se rattache pour nous au nom de Copernic, bien que la science alexandrine ait déjà annoncé quelque chose de semblable. Le second démenti fut infligé à l'humanité par la recherche biologique, lorsqu'elle a réduit à rien les prétentions de l'homme à une place privilégiée dans l'ordre de la création, en établissant sa descendance du règne animal et en montrant l'indestructibilité de sa nature animale. Cette dernière révolution s'est accomplie de nos jours, à la suite des travaux de Ch. Darwin, de Wallace et de leurs prédécesseurs, travaux qui ont provoqué la résistance la plus acharnée des contemporains. Un troisième démenti sera infligé à la mégalomanie humaine par la recherche psychologique de nos jours qui  se propose de montrer au moi qu'il seulement pas maître de sa propre maison, qu'il en est réduit à se contenter de renseignements rares et fragmentaires sur ce qui se passe, en dehors de sa conscience, dans sa vie psychique. Les psychanalystes ne sont ni les premiers ni les seuls qui aient lancé cet appel à la modestie et au recueillement, mais c'est à eux que semble échoir la mission d'étendre cette manière de voir avec le plus d'ardeur et de produire à son appui des matériaux empruntés à l'expérience et accessibles à tous. D'où la levée générale de boucliers contre notre science, l'oubli de toutes les règles de politesse académique, le déchaînement d'une opposition qui secoue toutes les entraves d'une logique impartiale.
Lévi-Strauss	<i>La pensée sauvage</i>, début du chap. 1. (éd. Plon, p. 3-5)	On s'est longtemps plu à citer ces langues où les termes manquent, pour exprimer des concepts tels que ceux d'arbre ou d'animal, bien qu'on y trouve tous les mots nécessaires à un inventaire détaillé des espèces et des variétés. Mais, en invoquant ces cas à l'appui d'une prétendue inaptitude des « primitifs » à la pensée abstraite, on omettait d’abord d'autres exemples, qui attestent que la richesse en mots abstraits n'est pas l'apanage des seules langues civilisées. C'est ainsi que le chinook, langue du nord‑ouest de l'Amé­rique du Nord, fait usage de mots abstraits pour désigner beaucoup de propriétés ou de qualités des êtres et des choses: « Ce procédé, dit Boas, y est plus fréquent que dans tout autre langage connu de moi. » La proposition: le méchant homme a tué le pauvre enfant, se rend en chinook par: la méchanceté de l'homme a tué la pauvreté de l'enfant; et, pour dire qu'une femme utilise un panier trop petit: elle met des racines de potentille dans la petitesse d'un panier à coquillages. (Boas 2, pp. 657‑658).<br/>Dans toute langue, d’ailleurs, ]e discours et la syntaxe fournissent les ressources indispensables pour suppléer aux lacunes du vocabulaire. Et le caractère tendancieux de l'ar­gument évoqué au paragraphe précédent est bien mis en évidence, quand on note que la situation inverse, c'est‑à‑dire celle où les termes très généraux l'emportent sur les appel­lations spécifiques, a été aussi exploitée pour affirmer l'indigence intellectuelle des sauvages: « Parmi les plantes et les animaux, I'Indien ne nomme que les espèces utiles ou nuisibles; les autres sont classées indistinctement comme oiseau, mauvaise herbe, etc. » (Krause, p. I04.)<br/>Un observateur plus récent semble pareillement croire que l'indigène nomme et conçoit, seulement en fonction de ses besoins: « Je me souviens encore de l'hilarité provoquée chez mes amis des îles Marquises par  l’intérêt (à leurs yeux pure sottise) témoigné par le botaniste de notre expédi­tion de I92I, envers les « mauvaises herbes » sans nom (« sans utilité ») qu'il recueillait, et dont il voulait savoir comment elles s’appelaient. » (Handy et Pukui, p. 119).<br/>Pourtant, Handy compare cette indifférence à celle que dans notre civilisation, le spécialiste témoigne aux phénomènes qui ne relèvent pas immédiatement de son domaine. Et quand sa collaboratrice indigène souligne qu'à Hawaii,  « chaque forme botanique, zoologique ou inorganique qu'on sait avoir été nommée (et personnalisée) était  une chose utilisée », elle prend soin d'ajouter: « d'une façon ou de l'autre », et elle précise que si « une variété illimitée d'êtres vivants de la mer et de la forêt, de phénomènes météorolo­giques ou marins, ne portaient pas de nom », la raison en était qu'on ne les jugeait pas « utiles ou dignes d’intérêt », termes non équivalents, puisque l'un se situe sur le plan pratique, et l'autre sur le plan théorique. La suite du texte le confirme, en renforçant le second aspect aux dépens du premier: « La vie, c'était l'expérience, chargée d'exacte et précise signification » (id, p. I9).<br/>En vérité le découpage conceptuel varie avec chaque langue, et, comme le remarquait fort bien, au XVIIIe siècle, le rédacteur de l'article « nom » dans l'Encyclopédie, I'usage de termes plus ou moins abstraits n'est pas fonction de capacités intellectuelles, mais des intérêts inégalement marqués et détaillés de chaque société particulière au sein de la société nationale: « Montez à l'observatoire; chaque étoile n'y est plus une étoile tout simplement, c'est l'étoile b du capri­corne. c'est le g du centaure, c'est le d de la grande ourse. etc., entrez dans un manège, chaque cheval y a son nom propre, le brillant, le lutin, le fougueux, etc. » D'ailleurs, même si la remarque sur les langues dites primitives, rap­pelée au début de ce chapitre, devait être prise au pied de la lettre, on n'en saurait conclure au défaut d'idées générales: les mots chêne, hêtre, bouleau, etc. ne sont pas moins des mots abstraits que le mot arbre, et, de deux langues dont I'une posséderait seulement ce dernier terme, et dont l'autre l'ignorerait tandis qu'elle en aurait plusieurs dizaines ou centaines affectés aux espèces et aux variétés, c'est la seconde, non la première, qui serait, de ce point de vue, la plus riche en concepts.<br/>Comme dans les langues de métier, la prolifération concep­tuelle correspond à une attention plus soutenue envers les propriétés du réel, à un intérêt mieux en éveil pour les dis­tinctions qu'on peut y introduire. Cet appétit de connais­sance objective constitue un des aspects les plus négligés de la pensée de ceux que nous nommons « primitiFs ». S'il est rarement dirigé vers des réalités du même niveau que celles auxquelles s'attache la science moderne, il implique des démarches intellectuelles et des méthodes d'observation com­parables. Dans les deux cas, I'univers est objet de pensée, au moins autant que moyen de satisfaire des besoins.
Paul Marchand	<i>Sympathie pour le diable</i>, Stock, p. 71-72	Les oreilles assourdies par les bruits destructeurs des confusions pire que le chaos, l’esprit tout entier braqué, tendu dans l’attente d’une balle dans le corps, le guerrier scrute cet autre, même s’il demeure anonyme. Quelquefois si proche qu’il pourrait avaler sans effort la dernière respiration de ce cadavre certain. Pris soudain d’une charnelle et sordide espérance de tuer, il fait feu et anéantit l’image consternante de sa propre mort. Le contact de l’ennemi est une liaison intime, un flirt avancé avec l’angoisse de sa mort. Souvent j’ai entendu, dans une tranchée, derrière une barricade ou dans une maison dévastée, un combattant avouer « C’était lui ou moi », à la place de « C’était elle ou moi ! ». Vivant mais sursitaire, il avait accosté la mort et ses grâces séduisantes. Ses dents, destinées à dépecer l’abondance, un temps l’avaient bercé, séduit puis effrayé. Sa mort se tenait là, à une encablure de lui. Elle s’était enveloppée du corps de son adversaire. La seule façon radicale de la refuser était de l’annihiler. Dans ces lieux de combats rapprochés, personne ne tue vraiment son ennemi, on arrache simplement une promesse formelle de mort. Par aucun pouvoir vivant la mort ne peut être vaincue. Son brillant maintien est le signe d’un gavage sans limites. Alors on glane un délai sur ces fronts où la vie est une agonie indéfectible.<br/>Et puis, lorsque le crépuscule des calvaires se confond avec la résonance des armes assoupies, quand l’herbe brûlée par la poudre cendrée se relève dans des tremblements désespérés qui étrillent le silence, la terre, elle aussi inquisitrice, sirote le sang fané des haillons rouges et disgracieux, abandonnées prostrés dans l’indolence de la mort. Ces rigoles de boue pourpres chargées des accablants secrets des consciences et des cœurs deviendront, à travers les différents filtres des couches géologiques, des eaux pures et vierges. Cette eau prospère fera fleurir des générations d’hommes gavées d’indices de sang. Une gale perfide et désacralisée pérennisera l’instinct de mort qui ne vacille jamais. L’habile cohérence des noires coulisses.
Pinker (Steven)	<i>Comprendre la nature humaine</i> (2002)	Les neurosciences cognitives montrent que le moi, lui aussi, n’est qu’un réseau de systèmes cérébraux. […].<br/>Alors que [Phineas Gage ] faisait pénétrer de la poudre d’explosif dans un trou de rocher à l’aide d’une barre à mine d’un mètre de long, une étincelle mit le feu à la poudre et projeta la barre qui lui transperça la joue et traversa le cerveau avant de ressortir au sommet du crâne. Il survécut, conservant intactes certaines fonctions, la perception, la mémoire, la parole, et la motricité. Cependant, selon le célèbre euphémisme d’un de ses camarades, « Gage n’était plus Gage ». Un morceau de fer avait littéralement fait de lui une autre personne. Lui qui était auparavant courtois et ambitieux et avait le sens des responsabilités, voilà qu’il était devenu grossier, apathique et peu fiable.<br/>C’est qu’il s’était empalé le cortex préfrontal ventromédian, cette région du cerveau située au-dessus des yeux dont on sait maintenant qu’elle intervient dans le raisonnement sur les autres individus. Avec d’autres aires des lobes préfrontaux et le système limbique (le siège des émotions), elle permet à l’individu d’anticiper les conséquences de ses actes et de choisir ses comportements en fonction de ses objectifs.
Karl Popper	<i>La société ouverte et ses ennemis</i> (t. 2 : Hegel et Marx), éditions du Seuil, 1979 [1962-1966], pp. 67-68 (chapitre 14).	Il existe une thèse, que j’appellerai la thèse du complot, selon laquelle il suffirait, pour expliquer un phénomène social, de découvrir ceux qui ont intérêt à ce qu’il se produise. Elle part de l’idée erronée que tout ce qui se passe dans une société, guerre, chômage, pénurie, pauvreté, etc., résulte directement des desseins d’individus ou de groupes puissants. Idée très répandue et fort ancienne, dont découle l’historicisme ; c’est, sous sa forme moderne, la sécularisation des superstitions religieuses. Les dieux d’Homère, dont les complots expliquent la guerre de Troie, y sont remplacés par les monopoles, les capitalistes ou les impérialistes.<br/>Je ne nie évidemment pas l’existence de complots. Ceux-ci se multiplient même chaque fois que des gens croyant à leur efficacité accèdent au pouvoir. Cependant, il est rare que ces complots réussissent à atteindre le but recherché, car la vie sociale n’est pas une simple épreuve de force entre groupes opposés, mais une action qui se déroule dans le cadre plus ou moins rigide d’institutions et de coutumes, et qui produit maintes réactions inattendues. Le rôle principal des sciences sociales est, à mon avis, d’analyser ces réactions et de les prévoir dans toute la mesure du possible.