Adorno	<i>Minima Moralia. Réflexions sur la vie mutilée</i>	C'Est Celui Qui Le Dit Qui Y Est ! – Ce qui est objectivement la vérité est déjà bien difficile à déterminer – mais, dans nos rapports avec les autres, il ne faut pas s'en laisser imposer le terrorisme. Et il existe là certains critères, qui suffisent dans un premier temps. Ainsi, et c'est un signe qui ne trompe pas, quand on vient vous objecter que ce que vous dites est “trop subjectif”. Quand on fait valoir cet argument, qui plus est avec l'indignation où vibre l'unanimité rageuse des gens raisonnables, on a toute raison d'être content de soi l'espace d'un instant. En effet, les concepts de “subjectif” et d' “objectif” se sont en l'occurrence complètement inversés. Ce qu'ils appellent “objectif”, c'est le jour incontesté sous lequel apparaissent les choses, leur empreinte prise telle quelle et non remise en question, la façade des faits classifiés : en somme, ce qui est subjectif. Et ce qu'ils nomment “subjectif”, c'est ce qui déjoue ces apparences, qui s'engage dans une expérience spécifique de la chose, se débarrasse des idées reçues la concernant et préfère la relation à l'objet lui-même au lieu de s'en tenir à l'avis de la majorité, de ceux qui ne regardent même pas et a fortiori ne pensent pas ledit objet : en somme, l'objectif. On voit combien les accusations formelles de subjectivisme et de relativisme tiennent peu dès qu'on aborde le domaine privilégié où elles sont invoquées, à savoir le domaine des jugements esthétiques. Celui qui s'est rigoureusement soumis aux exigences d'une œuvre d'art, à ses lois formelles immanentes et à la nécessité qui l'a façonnée, en mobilisant toutes les ressources de précision propres à sa sensibilité personnelle, il ne peut plus accorder crédit à de telles réserves qui lui objectent le caractère purement subjectif de son expérience et il mesure tout ce qu'elles ont d'illusoire. Chaque pas qui le fait avancer, grâce à sa réceptivité profondément subjective, au cœur même de la chose a incomparablement plus de valeur objective que des catégorisations englobantes et bien établies comme, par exemple, le concept de “style”, dont les prétentions de scientificité ne s'achètent qu'au prix de cette expérience elle-même. C'est encore plus vrai à l'époque du positivisme et de l'industrie de consommation culturelle où nous vivons, qui confie la définition de l'objectivité aux calculs des sujets qui organisent cette société. Face à cette objectivité-là, la raison s'est réfugiée complètement, en se fermant aux influences extérieures, dans les idiosyncrasies qui se voient reprocher leur arbitraire par l'arbitraire de ceux qui ont le pouvoir, car ces derniers veulent l'impuissance des sujets, par crainte d'une objectivité qui n'est conservée (aufgehoben) que par ces sujets.
Adorno	<i>Minima Moralia</i>	L'opinion répandue par les esthéticiens, selon laquelle l'œuvre d'art en tant qu'objet de contemplation immédiate doit être comprise uniquement à partir d'elle-même, ne résiste pas à l'examen. Elle ne trouve pas seulement ses limites dans les présupposés culturels d'une œuvre, dans son “langage” que seul un initié est en mesure de suivre. Même lorsque de telles difficultés ne se présentent pas, l'œuvre d'art demande plus que le simple abandon en elle-même. Celui qui veut déceler la beauté de La Chauve-souris doit savoir que c'est La Chauve-souris : il faut que sa mère lui ait expliqué qu'il ne s'agit pas seulement de l'animal ailé, mais d'un costume de bal masqué ; il faut qu'il se rappelle qu'on lui a dit : demain nous t'emmenons voir La Chauve-souris. Être inséré dans la tradition signifierait : vivre l'œuvre d'art comme quelque chose de confirmé, dont la valeur est reconnue, participer, dans le rapport que l'on a avec elle, aux réactions de tous ceux qui l'ont vue auparavant. Si toutes ces conditions viennent à manquer, l'œuvre apparaît dans toute sa nudité et sa faillibilité. L'action cesse d'être un rituel pour devenir une idiotie, la musique, au lieu d'être le canon de phrases riches de sens, paraît fade et insipide. Elle a vraiment cessé d'être belle. »
Alain		Dans le sommeil, je suis tout ; mais je n'en sais rien. La conscience suppose réflexion et division. La Conscience n'est pas immédiate. Je pense, et puis je pense que je pense, par quoi je distingue Sujet et Objet, Moi et le monde. Moi et ma sensation. Moi et mon sentiment. Moi et mon idée. C'est bien le pouvoir de douter qui est la vie du moi. Par ce mouvement, tous les instants tombent au passé. Si l'on se retrouvait tout entier, c'est alors qu'on ne se reconnaîtrait pas. Le passé est insuffisant, dépassé. Je ne suis plus Cet enfant, cet ignorant, ce naïf. A ce moment-là même j'étais autre chose, en espérance, en avenir. La Conscience de soi est la conscience d'un devenir et d'une formation de soi irréversible, irréparable. Ce que je voulais, je le suis devenu. Voilà le lien entre le passé et le présent, pour le mal comme pour le bien. Ansi le moi est un refus d'être moi, qui en même temps conserve les moments dépassés. Se souvenir, c'est sauver ses souvenirs, c'est se témoigner qu'on les a dépassés. C'est les juger. Le passé, ce sont des expériences que je ne ferais plus. Un artiste reconnaît dans ses œuvres qu'il ne s'était pas encore trouvé‚ lui-même, qu'il ne s'était pas encore délivré ; mais il y retrouve aussi un pressentiment de ce qui a suivi. C'est cet élan qui ordonne les souvenirs selon le temps.
Alain		Je n'ai pas beaucoup confiance dans ces jardins d'enfants et autres inventions au moyen desquelles on veut instruire en amusant. La méthode n'est déjà pas excellente pour les hommes. Je pourrais citer des gens qui passent pour instruits, et qui s'ennuient à la Chartreuse de Parme ou au Lys dans la vallée. Ils ne lisent que des œuvres de seconde valeur, où tout est disposé pour plaire au premier regard ; mais, en se livrant à des plaisirs faciles, ils perdent un plus haut plaisir qu'ils auraient conquis par un peu de courage et d'attention. Il n'y a point d'expérience qui élève mieux un homme que la découverte d'un plaisir supérieur, qu'il aurait toujours ignoré s'il n'avait point pris d'abord un peu de peine. Montaigne est difficile ; c'est qu'il faut d'abord le connaître, s'y orienter, s'y retrouver ; ensuite seulement on le découvre. De même la géométrie par cartons assemblés, cela peut plaire ; mais les problèmes plus vigoureux donnent aussi un plaisir bien plus vif. C'est ainsi que le plaisir de lire une œuvre au piano n'est nullement sensible dans les premières leçons ; il faut savoir s'ennuyer d'abord. C'est pourquoi vous ne pouvez faire goûter à l'enfant les sciences et les arts comme on goûte les fruits confits. L'homme se forme par la peine ; ses vrais plaisirs, il doit les gagner, il doit les mériter. Il doit donner avant de recevoir. C'est la loi.
Alain		Je puis vouloir une éclipse, ou simplement un beau soleil qui sèche le grain, au lieu de cette tempête grondeuse et pleureuse ; je puis, à force de vouloir, espérer et croire enfin que les choses iront comme je veux ; mais elles vont leur train. D'où je vois bien que ma prière est d'un nigaud. Mais quand il s'agit de mes frères les hommes, ou de mes sœurs les femmes, tout change. Ce que je crois finit souvent par être vrai. Si je me crois haï, je serai haï ; pour l'amour, de même. Si je crois que l'enfant que j'instruis est incapable d'apprendre, cette croyance écrite dans mes regards et dans mes discours le rendra stupide ; au contraire ma confiance et mon attente est comme un soleil qui mûrira les fleurs et les fruits du petit bonhomme. Je prête, dites-vous, à la femme que j'aime des vertus qu'elle n'a point ; mais si elle sait que je crois en elle, elle les aura. Plus ou moins ; mais il faut essayer ; il faut croire. Le peuple, méprisé, est bientôt méprisable ; estimez-le, il s'élèvera. La défiance a fait plus d'un voleur ; une demi-confiance est comme une injure ; mais si je savais la donner toute, qui donc me tromperait ? Il faut donner d'abord.
Alain		L'homme est courageux ; non pas à l'occasion mais essentiellement. Agir, c'est oser. Penser, c'est oser. Le risque est partout ; cela n'effraie point l'homme. Vous le voyez chercher la mort et la défier ; mais il ne sait point l'attendre. Tous ceux qui sont inoccupés sont assez guerriers par l'impatience. Ce n'est pas qu'ils veuillent mourir, mais c'est plutôt qu'ils veulent vivre. Et la vraie cause de la guerre est certainement l'ennui d'un petit nombre, qui voudraient des risques bien clairs, et même cherchés et définis, comme aux cartes. Et ce n'est point par hasard que ceux qui travaillent de leurs mains sont pacifiques ; c'est qu'aussi ils sont victorieux d'instant en instant. Leur propre durée est pleine et affirmative. Ils ne cessent pas de vaincre la mort, et telle est la vraie manière d'y penser.
Alain		La perception est exactement une anticipation de nos mouvements et de leurs effets. Et sans doute la fin est toujours d'obtenir ou d'écarter quelque sensation, comme si je veux cueillir un fruit ou éviter le choc d'une pierre. Bien percevoir, c'est connaître d'avance quel mouvement j'aurai à faire pour arriver à ces fins. Celui qui perçoit bien sait d'avance ce qu'il a à faire. Le chasseur perçoit bien s'il sait retrouver ses chiens qu'il entend, il perçoit bien s'il sait atteindre la perdrix qui s'envole. L'enfant perçoit mal lorsqu'il veut saisir la lune entre ses mains et ainsi du reste. Donc ce qu'il y a de vrai ou de douteux, ou de faux dans la perception, c'est cette évaluation, si sensible surtout à la vue dans la perspective et le relief, mais sensible aussi pour l'ouïe et l'odorat, et même sans doute pour un toucher exercé, quand les mains d'un aveugle palpent. Quant à la sensation elle-même, elle n'est ni douteuse, ni fausse ni par conséquent vraie ; elle est actuelle (1) toujours dès qu'on l'a. Ainsi ce qui est faux dans la perception d'un fantôme, ce n'est point ce que nos yeux nous font éprouver, lueur fugitive ou tache colorée, mais bien notre anticipation. Voir un fantôme c'est supposer, d'après les impressions visuelles, qu'en allongeant la main on toucherait quelque être animé (.. .). Mais pour ce que j'éprouve actuellement, sans aucun doute je l'éprouve ; il n'y a point de science de cela puisqu'il n'y a point d'erreur de cela. Toute étude de ce que je ressens consiste toujours à savoir ce que cela signifie et comment cela varie avec mes mouvements.
Alain		Les animaux, autant que l'on peut deviner, n'ont point de passions. Un animal mord ou s'enfuit selon l'occasion ; je ne dirai pas qu'il connaît la colère ou la peur, car rien ne laisse soupçonner qu'il veuille résister à l'une ou à l'autre, ni qu'il se sente vaincu par l'une ou par l'autre. Or c'est aussi pour la même raison que je suppose qu'il n'a point conscience. Remarquez que ce qui se fait par l'homme sans hésitation, sans doute de soi, sans blâme de soi, est aussi sans conscience. Conscience suppose arrêt, scrupule, division ou conflit entre soi et soi. Il arrive que, dans les terreurs paniques, l'homme est emporté comme une chose. Sans hésitation, sans délibération, sans égard d'aucune sorte. Il ne sait plus alors ce qu'il fait. Mais observez les actions habituelles tant qu'elles ne rencontrent point d'obstacles, nous ne savons pas non plus ce que nous faisons. Le réveil vient toujours avec le doute; il ne s'en sépare point. De même celui qui suit la passion n'a point de passion. La colère, le désir, la peur, ne sont plus alors que des mouvements.
Alain		Nous passons tous par cette expérience décisive, qui nous apprend en même temps la parole et la pensée. Nos premières idées sont des mots compris et répétés. L'enfant est comme séparé du spectacle de la nature, et ne commence jamais par s'en approcher tout seul ; on le lui montre et on le lui nomme. C'est donc à travers l'ordre humain qu'il connaît toute chose ; et c'est certainement de l'ordre humain qu'il prend l'idée de lui-même, car on le nomme, et on le désigne à lui-même, comme on lui désigne les autres. L'opposition du moi et du non-moi appartient aux théories abstraites ; la première opposition est certainement entre moi et les autres ; et cette opposition est corrélation ; car en l'autre je trouve mon semblable qui me pense comme je le pense. Cet échange, qui se fait d'abord entre la mère et l'enfant, est transporté peu à peu aux frères, aux amis, aux compagnons. Ces remarques sont pour rappeler qu'en toutes les recherches sur la nature humaine, il faut se tenir très près de l'existence collective, si naturelle à tout homme, et en tout cas seule possible pour l'enfant.
Alain		Par la géométrie je reconnais mon semblable ; et Socrate fit une grande chose le jour où il proposa le carré et la diagonale, tracés sur le sable, non point à Alcibiade ni à Ménon ni à quelqu'un de ces brillants messieurs, mais à un petit esclave qui portait les manteaux. Ainsi Socrate cherchait son semblable, et l'appelait dans cette solitude des êtres, que la société accomplit. Il formait donc cette autre société, de ses semblables ; il les invitait, il les poursuivait, mais il ne pouvait les forcer ; il ne pouvait ni ne voulait. Celui qui imite par force m'est aussi étranger qu'un singe. Celui qui imite pour plaire ne vaut pas mieux. Ce qu'attend Socrate, c'est que l'autre soit enfin lui-même, par intérieur gouvernement, et ne croie personne, et ne flatte personne, attentif seulement à l'idée universelle. A ce point, ils se reconnaissent et se décrètent égaux. Une autre société se montre.
Alain		Qui dit esprit dit, avant tout, conscience. Mais, qu'est- ce que la conscience ? Vous pensez bien que je ne vais pas définir une chose aussi concrète, aussi constamment présente à l'expérience de chacun de nous. Mais sans donner de la conscience une définition qui serait moins claire qu'elle, je puis la caractériser par son trait le plus apparent : conscience signifie d'abord mémoire. La mémoire peut manquer d'ampleur ; elle peut n'embrasser qu'une faible partie du passé ; elle peut ne retenir que ce qui vient d'arriver ; mais la mémoire est là, ou bien alors la conscience n'y est pas. Une conscience qui ne conserverait rien de son passé, qui s'oublierait sans cesse elle-même, périrait et renaîtrait à chaque instant : comment définir autrement l'inconscience ? […] Toute conscience est donc mémoire, - conservation et accumulation du passé dans le présent. Mais toute conscience est anticipation de l'avenir. Considérez la direction de votre esprit à n'importe quel moment : vous trouverez qu'il s'occupe de ce qui est, mais en vue surtout de ce qui va être. L'attention est une attente, et il n'y a pas de conscience sans une certaine attention à la vie. L'avenir est là; il nous appelle, ou plutôt il nous tire à lui : cette traction ininterrompue, qui nous fait avancer sur la route du temps, est cause aussi que nous agissons continuellement. Toute action est un empiètement sur l'avenir.
Alain		Tout amour est de quelque chose que l'on n'a pas en soi. Aimer, c'est trouver sa richesse hors de soi, je dis sa richesse intime, non sa parure ; et comme c'est de soi qu'on aime, ce n'est pas soi qu'on peut aimer. On aime l'image de soi que se font les autres, en ce sens que cette image, si elle est aimable, rend la société agréable et sûre. Mais cette image n'est point moi ; aucun objet, aucune chose n'est moi. […] Là-dessus aucune parure ne tient. Ce que je fais, cela seul est de moi ; mais en moi il n'en reste rien ; compter sur l'habitude et sur le talent c'est compter sur les autres ; il ne reste en moi que le courage; mais encore faut-il le faire et le porter ; dès qu'il est objet, dès qu'on voudrait l'aimer, il n'est plus. Si le souvenir console un peu, il est une charge aussi, s'il est beau. J'ai pensé souvent à ce musicien qui, après quelques œuvres de grande beauté, ne trouva plus rien de bon ; sans doute mit-il tout son génie à se condamner ; il mourut fou. Peut-être est-il sage de prendre un peu de vanité, mais sans s'y donner, comme on prend le soleil à sa porte.
Alain	<i>Propos sur le bonheur</i> (1925)	Tous ces coureurs se donnent bien de la peine. Tous ces joueurs de ballon se donnent bien de la peine. Tous ces boxeurs se donnent bien de la peine. On lit partout que les hommes cherchent le plaisir ; mais cela n'est pas évident ; il semble plutôt qu'ils cherchent la peine et qu'ils aiment la peine. Le vieux Diogène disait : “Ce qu'il y a de meilleur c'est la peine.” On dira là-dessus qu'ils trouvent tous leur plaisir dans cette peine qu'ils cherchent ; mais c'est jouer sur les mots ; c'est bonheur et non plaisir qu'il faudrait dire ; et ce sont deux choses très différentes, aussi différentes que l'esclavage et la liberté.<br/>On veut agir, on ne veut pas subir. Tous ces hommes qui se donnent tant de peine n'aiment sans doute pas le travail forcé ; personne n'aime le travail forcé ; personne n'aime les maux qui tombent ; personne n'aime sentir la nécessité. Mais aussitôt que je me donne librement de la peine, me voilà content. […]<br/>Le boxeur n'aime pas les coups qui viennent le trouver ; mais il aime ceux qu'il va chercher. Il n'est rien de si agréable qu'une victoire difficile, dès que le combat dépend de nous. Dans le fond, on n'aime que la puissance. Par les monstres qu'il cherchait et qu'il écrasait, Hercule se prouvait à lui-même sa puissance. Mais dès qu'il fut amoureux, il sentit son propre esclavage et la puissance du plaisir ; tous les hommes sont ainsi ; et c'est pourquoi le plaisir les rend tristes.<br/>L'avare se prive de beaucoup de plaisirs, et il se fait un bonheur vif, d'abord en triomphant des plaisirs, et aussi en accumulant de la puissance ; mais il veut la devoir à lui-même. Celui qui devient riche par héritage est un avare triste, s'il est avare ; car tout bonheur est poésie essentiellement, et poésie veut dire action ; l'on n'aime guère un bonheur qui vous tombe ; on veut l'avoir fait. L'enfant se moque de nos jardins, et il se fait un beau jardin, avec des tas de sable et des brins de paille. Imaginez-vous un collectionneur qui n'aurait pas fait sa collection ?
André Martinet	<i>Eléments de linguistique générale</i>, A. Colin, 1960, pp. 14-18	Selon une conception fort naïve, mais assez répandue, une langue serait un répertoire de mots, c'est-à-dire de productions vocales (ou graphiques), chacun correspondant à une chose ; à un certain animal, le cheval, le répertoire connu sous le nom de la langue française ferait correspondre une production vocale déterminée que l'orthographe représente sous la forme cheval ; les différences entre les langues se ramèneraient à des différences de désignations : pour le cheval, l'anglais dirait Horse et l'allemand Pferd ; apprendre une seconde langue consisterait simplement à retenir une nouvelle nomenclature en tous points parallèle à l'ancienne. […] Cette notion de langue-répertoire se fonde sur l'idée simpliste que le monde tout entier s'ordonne, antérieurement à la vision qu'en ont les hommes, en catégories d'objets parfaitement distinctes, chacun recevant nécessairement une désignation dans chaque langue.
Arendt	<i>La Crise de la culture</i>, trad. P. Lévy, Folio, Gallimard, p. 270-271	L'industrie des loisirs est confrontée à des appétits gargantuesques, et puisque la consommation fait disparaître ses marchandises, elle doit sans cesse fournir de nouveaux articles. Dans cette situation, ceux qui produisent pour les mass media pillent le domaine entier de la culture passée et présente, dans l'espoir de trouver un matériau approprié. Ce matériau, qui plus est, ne peut être présenté tel quel; il faut le modifier pour qu'il devienne loisir, il faut le préparer pour qu'il soit facile à consommer.<br/>La culture de masse apparaît quand la société de masse se saisit des objets culturels, et son danger est que le processus vital de la société (qui, comme tout processus biologique attire insatiablement tout ce qui est accessible dans le cycle de son métabolisme) consommera littéralement les objets culturels, les engloutira et les détruira. je ne fais pas allusion, bien sûr, à la diffusion de masse. Quand les livres ou reproductions sont jetés sur le marché à bas prix, et sont vendus en nombre considérable, cela n'atteint pas la nature des oeuvres en question. Mais leur nature est atteinte quand ces objets eux-mêmes sont modifiés - réécrits, condensés, digérés, réduits à l'état de pacotille pour la reproduction ou la mise en images. Cela ne veut pas dire que la culture se répande dans les masses, mais que la culture se trouve détruite pour engendrer le loisir. […] Bien des grands auteurs du passé ont survécu à des siècles d'oubli et d'abandon, mais c'est encore une question pendante de savoir s'ils seront capables de survivre à une version divertissante de ce qu'ils ont à dire.
Aristote		La question est embarrassante de savoir si, dans l'âme, le temps existerait ou non ; car, s'il ne peut y avoir rien qui nombre, il n'y aura rien de nombrable, par suite pas de nombre ; car est nombre ou le nombré ou le nombrable. Mais si rien ne peut par nature compter que l'âme, et dans l'âme, l'intelligence, il ne peut y avoir de temps sans l'âme, sauf pour ce qui est le sujet du temps, comme si par exemple on disait que le mouvement peut être sans l'âme. L'antérieur-postérieur est dans le mouvement et, en tant que nombre-nombrable, constitue le temps. D'autre part, c'est une question de savoir de quel mouvement le temps est nombre. Est-il nombre de n'importe quel mouvement ? Dans le temps, en effet, se produisent à la fois génération, destruction, accroissement, altération, transport ; en tant donc qu'il y a mouvement, dans cette mesure il y a un nombre pour chaque mouvement.
Aristote		Les gens qui font du mot égoïste un terme de réprobation appellent égoïstes ceux qui, qu'il s'agisse de richesses, d'honneurs, de plaisirs corporels prennent la part la plus grande ; tels sont en effet, pour la plupart des hommes, les objets de leurs désirs et de leurs efforts, car ils pensent que ce sont les plus grands des biens ; c'est pourquoi ce sont ceux qu'on se dispute le plus. Or, quand on place là son ambition, on s'abandonne à ses convoitises et, en général, à ses passions, et par conséquent à la partie irrationnelle de l'âme. Comme c'est là le cas de la plupart des hommes, la signification du mot vient de cet “égoïsme” de la masse, qui est vile. C'est donc avec justice qu'on méprise ceux qui sont égoïstes de cette manière. Que l'on appelle communément égoïstes ceux qui cherchent à se procurer ces sortes de biens, la chose est claire. Car s'il se trouve un homme qui s'applique constamment à accomplir plus que tout autre des actes de justice, de tempérance, ou de toute autre vertu, qui, en un mot, se réserve toujours à lui-même le beau - personne ne qualifiera cet homme d'égoïste ni ne le blâmera. Et pourtant c'est celui-la qui semblerait plutôt être égoïste ; il cherche, en tout cas à s'assurer à lui-même les choses les plus belles, les biens suprêmes ; il veut contenter la partie de lui-même qui a l'autorité souveraine, et il lui obéit en tout.
Aristote		Si tous les êtres désirent le plaisir, ne peut-on penser que c'est parce que tous aspirent à vivre ? Or, la vie est une activité, et chaque être exerce son activité sur les objets et avec les facultés qu'il apprécie le plus ; ainsi le musicien avec l'ouïe sur les mélodies, l'intellectuel avec la pensée sur les objets de contemplation, et ainsi de suite. Or, le plaisir perfectionne les activités, et donc la vie, que tous les êtres désirent. Il est donc normal qu'ils aspirent tous du même coup au plaisir ; car le plaisir perfectionne pour chacun la vie, qui lui est précieuse. Mais si nous attachons du prix à la vie, est-ce à cause du plaisir qu'elle procure, ou, si nous attachons du prix au plaisir, est-ce à cause de la vie qu'il accroît ?
