Pascal	<i>Pensées</i>	Ce n'est point de l'espace que je dois chercher ma dignité, mais c'est du règlement de ma pensée. Je n'aurai point d’avantage en possédant des terres. Par l'espace, l'univers me comprend et m'engloutit comme un point ; par la pensée, je le comprends.La grandeur de l’homme est grande en ce qu’il se connaît misérable ; un arbre ne se connaît pas misérable.C’est donc être misérable que de se connaître misérable, mais c’est être grand que de connaître qu’on est misérable.L'homme n'est qu'un roseau, le plus faible de la nature, mais c'est un roseau pensant. Il ne faut pas que l'univers entier s'arme pour l'écraser ; une vapeur, une goutte d'eau, suffit pour le tuer. Mais, quand l'univers l'écraserait, l'homme serait encore plus noble que ce qui le tue, puisqu'il sait qu'il meurt, et l'avantage que l'univers a sur lui, l'univers n'en sait rien.Toute notre dignité consiste donc en la pensée. C'est de là qu'il faut nous relever et non de l'espace et de la durée, que nous ne saurions remplir. Travaillons donc à bien penser : voilà le principe de la morale.
Pascal	<i>Pensées</i> (1669)	[Peu de tout]. Puisqu'on ne peut être universel en sachant tout ce qui se peut savoir sur tout, il faut savoir peu de tout, car il est bien plus beau de savoir quelque chose de tout que de savoir tout d'une chose. Cette universalité est la plus belle. Si on pouvait avoir les deux encore mieux, mais s'il faut choisir il faut choisir celle‑là. Et le monde le sent et le fait, car le monde est un bon juge souvent.
Peirce	<i>Elements of Logic</i>, (1903), in Collected Papers, Harvard University Press, 1960	247. Un Icone est un signe qui fait référence à l'Objet qu'il dénote simplement en vertu de ses caractères propres, lesquels il possède, qu'un tel Objet existe réellement ou non. […] N'importe quoi, que ce soit une qualité, un existant individuel, ou une loi, est un icone de n'importe quoi, dans la mesure ou il ressemble à cette chose et en est utilisé comme le signe.<br/>248. Un Indice est un signe qui fait référence à l'Objet qu'il dénote en vertu du fait qu'il est réellement affecté par cet Objet. […] Dans la mesure où l'Indice est affecté par l'Objet, il a nécessairement certaines qualités en commun avec cet Objet, et c'est sous ce rapport qu'il réfère à l'Objet. Il implique, par conséquent, une certaine relation iconique à l'Objet, mais un icone d'un genre particulier; et ce n'est pas la simple ressemblance à son Objet, même sous ces rapports, qui en font un signe mais les modifications réelles qu'il subit de la part de l'Objet.<br/>249. Un Symbole est un signe qui se réfère à l'Objet qu'il dénote en vertu d'une loi, habituellement une association générale d'idées, qui provoque le fait que le Symbole est interprété comme référant à l'Objet.
Platon		Parmi les plaisirs et les désirs non nécessaires, certains me semblent illégitimes ; ils sont probablement innés en chacun de nous mais réprimés par les lois et les désirs meilleurs, avec l'aide de la raison, ils peuvent chez quelques-uns, être totalement extirpés ou ne rester qu'en petit nombre et affaiblis, tandis que chez les autres, ils subsistent plus forts et plus nombreux. Mais de quels désirs parles-tu ? De ceux, répondis-je, qui s'éveillent pendant le sommeil, lorsque repose cette partie de l'âme qui est raisonnable, douce et faite pour commander à l'autre, et que la partie bestiale et sauvage, gorgée de nourriture et de vin, tressaille, et après avoir secoué le sommeil, part en quête de satisfactions à donner à ses appétits. Tu sais qu'en pareil cas, elle ose tout, comme si elle était délivrée et affranchie de toute honte et de toute prudence. Elle ne craint point d'essayer, en imagination, de s'unir à sa mère, ou à qui que ce soit, homme, dieu ou bête, de se souiller de n'importe quel meurtre, et de ne s'abstenir d'aucune sorte de nourriture ; en un mot, il n'est point de folie, point d'impudence dont elle ne soit capable.
Platon	<i>Apologie de Socrate</i>	Admettons que, malgré cela, vous me teniez ce langage : Socrate, nous ne voulons pas en croire Anytos, nous voulons t’acquitter, à une condition toutefois : c’est que tu ne passeras plus tout ton temps à examiner ainsi les gens, ni à philosopher. Si on t’y reprend, tu mourras. Cette condition là, juges, si pour m'acquitter, vous vouliez me l'imposer, je vous dirais: Athéniens, je vous sais gré et je vous aime; mais j'obéirai au dieu plutôt qu'à vous; et tant que j'aurai un souffle de vie, tant que j'en serai capable, soyez sûrs que je ne cesserai de philosopher, de vous exhorter, de faire la leçon à qui de vous que je rencontrerai. Et je lui dirai comme j'ai coutume de le faire: “Quoi! cher ami, tu es Athénien, citoyen d'une ville qui est plus grande, plus renommée qu'aucune autre pour sa science et sa puissance, et tu ne rougis pas de donner tes soins à ta fortune, pour l'accroître le plus possible, ainsi qu'à ta réputation et à tes honneurs ; mais quant à ta raison, quant à la vérité, quant à ton âme qu'il s'agirait d'améliorer sans cesse, tu ne t'en soucies pas, tu n'y songes pas! Et si quelqu'un de vous conteste, s'il affirme qu'il en a soin, ne croyez pas que je vais le lâcher et m'en aller immédiatement: non, je l'interrogerai, je l'examinerai, je discuterai à fond. Alors, s'il me paraît certain qu'il ne possède pas la vertu, quoi qu'il en dise, je lui reprocherai d'attacher si peu de prix à ce qui en a le plus, tant de valeur à ce qui en a le moins. jeunes ou vieux, quel que soit celui que j'aurai rencontré, étranger ou concitoyen, c'est ainsi que j’agirai avec lui, et surtout avec vous, mes concitoyens, puisque vous me tenez de plus près par le sang. Car c'est là ce que m'ordonne le dieu, entendez-le bien; et, de mon côté, je pense que jamais rien de plus avantageux n'est échu à la cité que mon zèle à exécuter cet ordre. Ma seule affaire, c'est en effet d'aller par les rues pour vous persuader, jeunes et vieux, de ne vous préoccuper ni de votre corps, ni de votre fortune aussi passionnément que de votre âme, pour la rendre aussi bonne que possible; oui, ma tâche est de vous dire que la fortune ne fait pas la vertu; mais que de la vertu provient la fortune et tout ce qui est avantageux, soit aux particuliers, soit à l'État. Si c'est par ce langage que je corromps les jeunes gens, il faut donc que cela soit nuisible. Quant à prétendre que ce n'est pas là ce que je dis, quiconque l'affirme ne dit rien qui vaille.” “Là-dessus, dirais-je, croyez Anytos ou ne le croyez pas, Athéniens, acquittez-moi ou ne m'acquittez pas - mais tenez pour certain que je ne changerai jamais de conduite, quand je devrais mille fois m'exposer à la mort
Platon	<i>Gorgias</i>	Il est beau d’étudier la philosophie dans la mesure où elle sert à l’instruction et il n’y a pas de honte pour un jeune garçon à philosopher ; mais, lorsqu’on continue à philosopher dans un âge avancé, la chose devient ridicule, Socrate, et, pour ma part, j’éprouve à l’égard de ceux qui cultivent la philosophie un sentiment très voisin de celui que m’ins­pirent les gens qui balbutient et font les enfants. Quand je vois un petit enfant, à qui cela convient encore, bal­butier et jouer, cela m’amuse et me paraît charmant, digne d’un homme libre et séant à cet âge, tandis que, si j’entends un bambin causer avec netteté, cela me paraît choquant, me blesse l’oreille et j’y vois quelque chose de servile. Mais si c’est un homme fait qu’on entend ainsi balbutier et qu’on voit jouer, cela semble ridicule, indigne d’un homme, et mérite le fouet.C’est juste le même sentiment que j’éprouve à l’égard de ceux qui s’adonnent à la philosophie. J’aime la philo­sophie chez un adolescent, cela me paraît séant et dénote à mes yeux un homme libre. Celui qui la néglige me paraît au contraire avoir une âme basse, qui ne se croira jamais capable d’une action belle et généreuse. Mais quand je vois un homme déjà vieux qui philosophe encore et ne renonce pas à cette étude, je tiens, Socrate, qu’il mérite le fouet. Comme je le disais tout à l’heure, un tel homme, si parfaitement doué qu’il soit, se condamne à n’être plus un homme, en fuyant le cœur de la cité et les assemblées où, comme dit le poète, les hommes se distinguent, et passant toute sa vie dans la retraite à chuchoter dans un coin avec trois ou quatre jeunes garçons, sans que jamais il sorte de sa bouche aucun discours libre, grand et géné­reux. » […]En ce moment même, si l’on t’arrêtait, toi ou tout autre de tes pareils, et si l’on te traînait en prison, en t’accusant d’un crime que tu n’aurais pas commis, tu sais bien que tu serais fort embarrassé de ta personne, que tu perdrais la tête et resterais bouche bée sans savoir que dire, et que, lorsque tu serais monté au tribunal, quelque vil et méprisable que fût ton accusateur, tu serais mis à mort, s’il lui plaisait de réclamer cette peine. Or qu’y a t il de sage, Socrate, dans un art qui “prenant un homme bien doué le rend pire”, impuissant à se défendre et à sauver des plus grands dangers, soit lui-même, soit tout autre, qui l’expose à être dépouillé de tous ses biens par ses ennemis et à vivre absolument sans honneur dans sa patrie ? Un tel homme, si l’on peut user de cette expression un peu rude, on a le droit de le souffleter impu­nément. Crois moi donc, mon bon ami, renonce à tes arguties, cultive la belle science des affaires, exerce toi à ce qui te donnera la réputation d’un habile homme ; “laisse à d’autres ces gentillesses”, de quelque nom, radotages ou niaiseries, qu’il faille les appeler, “qui te réduiront à habiter une maison vide. Prends pour modèle non pas des gens qui ergotent sur ces bagatelles, mais ceux qui ont du bien, de la réputation et mille autres avantages
Platon	<i>Gorgias</i>, 457c-458b, trad. B. Piettre, Hatier, coll. Les classiques de la philosophie, 2000, p. 28-30	SOCRATE. - Je pense, Gorgias, que tu as l'expérience de nombreuses discussions et que tu as remarqué ceci : ce n'est pas sans mal que les interlocuteurs définissent les uns les autres les sujets sur lesquels ils engagent une discussion, et parviennent à quitter un entretien en ayant appris quelque chose et en s'étant instruits eux-mêmes; si, au contraire, ils sont en désaccord sur une chose et que l'un refuse d'admettre que l'autre ait raison ou se soit exprimé clairement, alors ils se fâchent et soupçonnent l'autre de malveillance, plus enclins qu'ils sont à avoir le dessus qu'à examiner ce qui fait l'objet de la discussion. Il y en a même qui finissent par se séparer de la façon la pus moche, en se faisant insulter, après y avoir dit et entendu sur leur propre compte de telles horreurs que même les gens présents à la discussion s'en veulent d'avoir jugé bon d'être les auditeurs de tels individus.<br/>Pourquoi je te dis cela ? Parce que tu me parais dire à présent des choses qui ne sont plus en accord et en harmonie avec de que tu disais sur la rhétorique en commençant. J'hésite dans ces conditions à te réfuter, de peur que tu aies dans l'idée que je cherche à avoir le dessus dans la discussion, sans viser la question pour la rendre plus claire, mais en te visant toi. Moi, en tout cas, si tu es de ces gens qui sont comme moi, c'est avec plaisir que je t'interrogerai; sinon, je devrais renoncer. Quelle sorte d'homme suis-je ? De ceux qui ont plaisir à être réfutés, si je dis quelque chose qui n'est pas vrai, mais qui ont plaisir à réfuter si un autre dit une chose qui n'est pas vraie, et qui n'ont pas moins de plaisir à être réfutés qu'à réfuter. […] Si tu prétends toi aussi avoir cette tournure d'esprit, poursuivons la discussion; mais si tu crois qu'il faut l'abandonner, tenons-nous-en là et mettons fin à la discussion.
Platon	<i>Le Banquet</i>	Diotime. — […] Comme fils de Poros et de Pénia, voici quel fut le partage de l'Amour : d'abord il est toujours pauvre, et, loin d'être beau et délicat, comme on le pense généralement, il est maigre, malpropre, sans chaussures, sans domicile, sans autre lit que la terre, sans couverture, couchant à la belle étoile auprès des portes et dans les rues; enfin, comme sa mère, toujours dans le besoin. Mais, d'autre part, selon le naturel de son père, il est toujours à la piste de ce qui est beau et bon; il est mâle, hardi, persévérant, chasseur habile, toujours machinant quelque artifice, désireux de savoir et apprenant avec facilité, philosophant sans cesse, enchanteur, magicien, sophiste. De sa nature, il n'est ni mortel ni immortel. Mais, dans le même jour, il est florissant et plein de vie, tant qu'il est dans l'abondance, puis il s'éteint, pour revivre encore par l'effet de la nature paternelle. Tout ce qu'il acquiert lui échappe sans cesse, en sorte qu'il n'est jamais ni riche ni pauvre. Il tient aussi le milieu entre la sagesse et l'ignorance, car aucun dieu ne philosophe ni ne désire devenir sage, puisque la sagesse est le propre de la nature divine; et, en général, quiconque est sage ne philosophe pas. Il en est de même des ignorants : aucun d'eux ne philosophe ni ne désire devenir sage, car l'ignorance a précisément le fâcheux effet de persuader ceux qui ne sont ni beaux, ni bons, ni sages, qu'ils possèdent ces qualités; or nul ne désire les choses dont il ne se croit point dépourvu.<br/>Socrate. — Mais, Diotime, qui sont donc ceux qui philosophent, si ce ne sont ni les sages ni les ignorants ?<br/>— Il est évident, même pour un enfant, dit-elle, que ce sont ceux qui tiennent le milieu entre les ignorants et les sages, et l'Amour est de ce nombre. La sagesse est une des plus belles choses du monde; or l'Amour aime ce qui est beau; en sorte qu'il faut conclure que l'Amour est amant de la sagesse, c'est-à-dire philosophe, et, comme tel, il tient le milieu entre le sage et l'ignorant.
Platon	<i>Le banquet</i>	Quand on dit de chaque être vivant qu'il vit et qu'il reste le même - par exemple, on dit qu'il reste le même de l'enfance à la vieillesse -, cet être en vérité n'a jamais en lui les mêmes choses. Même si l'on dit qu'il reste le même, il ne cesse pourtant, tout en subissant certaines pertes, de devenir nouveau, par ses cheveux, par sa chair, par ses os, par son sang, c'est-à-dire par tout son corps. Et cela est vrai non seulement de son corps, mais aussi de son âme. Dispositions, caractères, opinions, désirs, plaisirs, chagrins, craintes, aucune de ces choses n'est jamais identique en chacun de nous; bien au contraire, il en est qui naissent, alors que d'autres meurent. C'est en effet de cette façon que se trouve assurée la sauvegarde de tout ce qui est mortel; non pas parce que cet être reste toujours exactement le même à l'instar de ce qui est divin, mais parce que ce qui s'en va et qui vieillit laisse place à un être nouveau, qui ressemble à ce qu'il était. Voilà par quel moyen, Socrate, ce qui est mortel participe de l'immortalité, tant le corps que tout le reste.
Platon	<i>Théétète, 174a-175c.</i>	Thalès observait les astres et, comme il avait les yeux au ciel, il tomba dans un puits. Une servante de Thrace, fine et spirituelle, le railla, dit-on, en disant qu'il s'évertuait à savoir ce qui se passait dans le ciel, et qu'il ne prenait pas garde à ce qui était devant lui et à ses pieds. La même plaisanterie s'applique à tous ceux qui passent leur vie à philosopher. Il est certain, en effet, qu'un tel homme ne connaît ni proche, ni voisin ; il ne sait pas ce qu'ils font, sait à peine si ce sont des hommes ou des créatures d'une autre espèce ; mais qu'est-ce que peut être l'homme et qu'est-ce qu'une telle nature doit faire ou supporter qui la distingue des autres êtres, voilà ce qu'il cherche et prend peine à découvrir.[…]Voilà donc, ami […] ce qu'est notre philosophe dans les rapports privés et publics qu'il a avec ses semblables. Quand il est forcé de discuter dans un tribunal ou quelque part ailleurs sur ce qui est à ses pieds et devant ses yeux, il prête à rire non seulement aux servantes de Thrace, mais encore au reste de la foule, son inexpérience le faisant tomber dans les puits et dans toute sorte de perplexités. Sa terrible gaucherie le fait passer pour un imbécile. […] Entend-il parler d'un homme qui possède dix mille plèthres de terre comme d'un homme prodigieusement riche, il trouve que c'est très peu de chose, habitué qu'il est à jeter les yeux sur la terre entière. Quant à ceux qui chantent la noblesse et disent qu'un homme est bien né parce qu'il peut prouver qu'il a sept aïeux riches, il pense qu'un tel éloge vient de gens qui ont la vue basse et courte, parce que, faute d'éducation, ils ne peuvent jamais fixer leurs yeux sur le genre humain tout entier, ni se rendre compte que chacun de nous a d'innombrables myriades d'aïeux et d'ancêtres, parmi lesquels des riches et des gueux, des rois et des esclaves, des barbares et des Grecs se sont succédé par milliers dans toutes les familles. […] Dans toutes ces circonstances, le vulgaire se moque du philosophe, qui tantôt lui paraît dédaigneux tantôt ignorant de ce qui est à ses pieds et embarrassé sur toutes choses.
Popper (Karl)	<i>Conjectures et réfutation</i> (1963)	1) Si ce sont des confirmations que l'on recherche, il n'est pas difficile de trouver, pour la grande majorité des théories, des confirmations ou des vérifications.<br/>2) Il convient de ne tenir réellement compte de ces confirmations que si elles sont le résultat de prédictions qui assument un certain risque; autrement dit, si, en l'absence de la théorie en question, nous avions dû escompter un événement qui n'aurait pas été compatible avec celle-ci - un événement qui l'eût réfutée.<br/>3) Toute “bonne” théorie scientifique consiste à proscrire : à interdire à certains faits de se produire. Sa valeur est proportionnelle à l'envergure de l'interdiction.<br/>4) Une théorie qui n'est réfutable par aucun événement qui se puisse concevoir est dépourvue de caractère scientifique. Pour les théories, l'irréfutabilité n'est pas (comme on l'imagine souvent) vertu mais défaut.<br/>5) Toute mise à l'épreuve véritable d'une théorie par des tests constitue une tentative pour en démontrer la fausseté (<em>to falsify</em>) ou pour la réfuter. Pouvoir être testé c'est pouvoir être réfuté; mais cette propriété comporte des degrés : certaines théories se prêtent plus aux tests, s'exposent davantage à la réfutation que les autres, elles prennent, en quelque sorte, de plus grands risques.<br/>6) On ne devrait prendre en considération les preuves qui apportent confirmation que dans les cas où elles procèdent de tests authentiques subis par la théorie en question : on peut donc définir celles-ci comme des tentatives sérieuses, quoique infructueuses, pour invalider telle théorie […].<br/>On pourrait résumer ces considérations ainsi : le critère de la scientificité d'une théorie réside dans la possibilité de l'invalider, de la réfuter ou encore de la tester.
Proudhon	<i>Qu'est-ce que la propriété ?</i> (1840)	Le capitaliste, dit-on, a payé les journées des ouvriers ; pour être exact, il faut dire que le capitaliste a payé autant de fois une journée qu'il a employé d'ouvriers chaque jour, ce qui n'est point du tout la même chose. Car, cette force immense qui résulte de l'union et de l'harmonie des travailleurs, de la convergence et de la simultanéité de leurs efforts, il ne l'a point payée. Deux cents grenadiers ont en quelques heures dressé l'obélisque de Luqsor sur sa base ; suppose-t-on qu'un seul homme, en deux cents jours, en serait venu à bout ? Cependant, au compte du capitaliste, la somme des salaires eût été la même. Eh bien, un désert à mettre en culture, une maison à bâtir, une manufacture à exploiter, c'est l'obélisque à soulever, c'est une montagne à changer de place. La plus petite fortune, le plus mince établissement, la mise en train de la plus chétive industrie, exige un concours de travaux et de talents si divers, que le même homme n'y suffirait pas.
Rawls (John)	<i>Théorie de la justice</i> (1971)	Imaginons, par exemple, quelqu'un dont le seul plaisir est de compter les brins d'herbe dans divers espaces ayant des formes géométriques, comme des parcs publics ou des pelouses bien tenus. Par ailleurs, il est intelligent et possède des talents inhabituels puisqu'il réussit à gagner sa vie en se faisant payer pour résoudre des problèmes mathématiques difficiles. La définition du bien nous force à admettre que le bien, pour cet homme, c'est de compter les brins d'herbe ou, plus exactement, que son bien est déterminé par un projet qui donne une place particulièrement importante à cette activité. Nous serions évidemment surpris si un tel individu existait. Face à un tel cas, nous envisagerions d'autres hypothèses. Peut-être est-il particulièrement névrosé et a-t-il acquis dans l'enfance une aversion pour la compagnie des hommes, ainsi compter les brins d'herbe lui évite d'avoir affaire aux autres hommes. Mais, si nous supposons que sa nature est telle qu'il aime cette activité et pas une autre, et qu'il n'est pas possible de modifier sa nature, alors il est certain qu'un projet qui serait rationnel pour lui devrait être centré sur cette activité. Elle est la fin qui commande le programme de ses activités, qui établit ce qui est bon pour lui.
Récanati (François)	<i>La transparence et l'énonciation</i> (1979)	Quand on lit un livre, on ne fait pas attention aux caractères, mais à ce qu'ils représentent. Au contraire, si on porte l'attention sur les caractères eux-mêmes, alors on perd de vue ce qu'ils représentent. Il y a là quelque chose de paradoxal : d'un côté, pour accéder à la chose représentée, on doit recourir au signe, à la chose représentante, car nous connaissons la chose représentée par son intermédiaire; mais d'un autre côté, on doit faire abstraction du signe, de la chose représentante, pour accéder à ce qu'elle représente : on doit faire comme si le signe n'existait pas, on doit le traiter comme rien. Le signe doit être à la fois présent et absent pour représenter la chose signifiée. […]<br/>C'est le paradoxe de la présence-absence du signe. Il faut que le signe soit présent (pour représenter la chose signifiée) ; mais s'il est trop présent, il finit par cacher la chose qu'il est censé dévoiler. Pour accéder à la chose signifiée, on doit certes passer par le signe, mais on ne doit surtout pas s'y arrêter. Quand le doigt montre la lune, il ne faut pas, comme l'imbécile selon un proverbe connu, regarder le doigt.
Reid (Thomas)	<i>Essais sur les pouvoirs intellectuels de l'homme</i> (1783)	Imaginez un officier courageux qui, écolier, a reçu les verges pour avoir chapardé des fruits dans un verger, qui a pris un étendard à l'ennemi dans sa première campagne et qui, avançant dans la vie, a été fait général ; imaginez aussi – chose possible, il faut bien l'admettre -, qu'au moment de s'emparer de l'étendard il avait conscience d'avoir été fouetté à l'école, et qu'au moment d'être fait général il avait souvenir d'avoir pris l'étendard, mais avait totalement oublié d'avoir un jour reçu les verges. Cela étant, il s'ensuit, d'après la doctrine de Locke, que l'individu fouetté à l'école est la même personne qui a pris l'étendard, et que celui qui s'est emparé de l'étendard est la même personne qui a été fait général. D'où il s'ensuit, s'il y a la moindre vérité dans la logique, que le général et l'enfant fouetté ne font qu'un. Or la conscience du général ne remonte pas jusqu'au moment de son châtiment ; donc suivant la doctrine de M. Locke, il n'est pas celui qui a été fouetté. Le général est donc et n'est pas, tout à la fois la même personne que celle qui a reçu les verges à l'école.
Reid (Thomas)	<i>Essais sur les pouvoirs intellectuels de l'homme</i> (1783)	Une partie d'une personne est une absurdité flagrante. Qu'un homme perde ses biens, sa santé, sa force, il reste la même personne et n'a rien perdu de sa personnalité. Qu'on l'ampute d'une jambe ou d'un bras, il est la même personne qu'avant. Le membre amputé ne fait point partie de sa personne, sans quoi il aurait eu droit à une partie de ses biens et serait comptable d'une partie de ses engagements. Il aurait droit à une part de ses mérites et de ses démérites, ce qui est manifestement absurde. Une personne est quelque chose d'indivisible […]. Mes pensées, mes actions et mes sentiments changent à chaque instant ; leur existence est non pas continue, mais successive ; cependant, ce moi ou ce je, auquel ils appartiennent, est permanent et entretient le même rapport avec toutes les pensées, toutes les actions et tous les sentiments successifs que je dis miens.
